{
  "schema_version": 1,
  "task_id": "V0.3-12-A",
  "agent": "sub-a",
  "branch": "feature/v0.3-12-desktop-project-open-foundation",
  "base_sha": "8522c0f2d33391a2d2092e648c446f5813187e98",
  "head_sha": "cd284ed9b042bb47e200b035ed5bc00a7e92b8c9",
  "commits": [
    "cd284ed9b042bb47e200b035ed5bc00a7e92b8c9 feat(desktop): add the Runtime project read-model client"
  ],
  "changed_files": [
    "apps/desktop/src/runtime/project-client.test.ts",
    "apps/desktop/src/runtime/project-client.ts"
  ],
  "ownership_compliance": true,
  "tests": [
    {
      "name": "frontend-test",
      "command": "pnpm test",
      "result": "passed"
    },
    {
      "name": "frontend-typecheck",
      "command": "pnpm typecheck",
      "result": "passed"
    },
    {
      "name": "frontend-lint",
      "command": "pnpm lint",
      "result": "passed"
    }
  ],
  "lint": "eslint . --max-warnings 0 — exit 0",
  "typecheck": "tsc -b --pretty false — exit 0",
  "ci": "PR #20, Quality Gate success on head a63667a (run 35418026596); this delivery is inside that head's history",
  "dependencies": [],
  "known_issues": [
    "The delivery range is base_sha=8522c0f -> head_sha=cd284ed, i.e. exactly this task's own commit. In native-shared mode base_sha is the integration head the delivery was applied to, not the dispatch base (451352f); the contract was re-issued at revision 2 to record the execution coordinates it actually had.",
    "The worker envelope for this task came back with status 'blocked' from the harness write gate (a scoped tsc that did not run to completion), not from a test failure. The Main Agent re-ran every required test itself; the results above are those runs.",
    "The runtime client has no production UI caller yet — this increment is a foundation (AGENT_02_PILOT_PLAN / V0.3-12 non-goals: no Project Picker UI)."
  ],
  "deferred_items": [
    "A live-Runtime smoke of inspectProject against a running sidecar on 127.0.0.1:8765 (NOT VERIFIED; all assertions use a stubbed fetch)"
  ],
  "ready_for_integration": true
}
