{
  "schema_version": 1,
  "task_id": "V0.4-01",
  "agent": "sub-a",
  "branch": "agent/V0.4-01-recorder-control-plane",
  "base_sha": "127ee2ff3ba0600afc3c7826e879981ef0a64867",
  "head_sha": "e82d6f45eb9be8db955fb548dd33bd878b7b6b90",
  "commits": [
    "e82d6f45eb9be8db955fb548dd33bd878b7b6b90 feat(recorder): add the Recorder control plane and persisted session API (V0.4-01)"
  ],
  "changed_files": [
    "docs/acceptance/v0.4-01-recorder-control-plane.md",
    "runtime/canx/api/app.py",
    "runtime/canx/api/recorder.py",
    "runtime/canx/recorder/control.py",
    "runtime/canx/recorder/project_recorder.py",
    "runtime/canx/runtime/service.py",
    "tests/integration/test_recorder_control_plane.py",
    "tests/unit/api/test_recorder_api.py",
    "tests/unit/recorder/test_recorder_control.py"
  ],
  "ownership_compliance": true,
  "tests": [
    {"name": "recorder-control-plane-focused", "command": "pytest tests/unit/recorder tests/unit/api/test_recorder_api.py tests/integration/test_recorder_control_plane.py -q -> 67 passed", "result": "passed"},
    {"name": "runtime-pytest", "command": "pytest -q -> 2931 passed, 8 skipped, exit 0", "result": "passed"},
    {"name": "runtime-ruff", "command": "ruff check . -> All checks passed!", "result": "passed"},
    {"name": "runtime-mypy", "command": "mypy runtime tools -> Success: no issues found in 105 source files", "result": "passed"}
  ],
  "lint": "ruff check . - All checks passed (re-run by the Main Agent in the worktree)",
  "typecheck": "mypy runtime tools - Success, 105 source files (re-run by the Main Agent in the worktree)",
  "ci": "not run: no GitHub CI on this worktree branch in this environment",
  "dependencies": [],
  "known_issues": [
    "Provenance: the Sub-Agent exhausted its turn budget after implementing the code and its targeted tests; the full pytest -q, mypy, a clean ruff re-run, the acceptance document and the commit were completed by the Main Agent. Every number here is a Main Agent re-run in the task worktree.",
    "tests/integration/test_packaged_runtime_smoke.py skips in the worktree (no packaged canx-runtime.exe built) - environment, not a failure.",
    "GitHub CI / Quality Gate not verified; independent acceptance and the protected merge remain outstanding (this is a handoff, not an acceptance)."
  ],
  "deferred_items": [],
  "ready_for_integration": true
}
