{
  "schema_version": 1,
  "task_id": "V0.3-12-VERIFY-A",
  "agent": "sub-a",
  "branch": "feature/v0.3-12-desktop-project-open-foundation",
  "base_sha": "c35be8b6ecd060e0d4c0ca63a4237b9f9004ba66",
  "head_sha": "015a9a76793580e42335b48d9667c0c34547effe",
  "commits": [
    "015a9a76793580e42335b48d9667c0c34547effe chore(agent): V0.3-12-VERIFY-A verification evidence"
  ],
  "changed_files": [
    ".agent/telemetry/v0.3-12-verification-a.json"
  ],
  "ownership_compliance": true,
  "tests": [
    {
      "name": "verification",
      "command": "cd apps/desktop && ./node_modules/.bin/vitest run src/runtime/project-client.test.ts",
      "result": "passed"
    }
  ],
  "lint": "not applicable - read-only verification, no source file modified",
  "typecheck": "not applicable - read-only verification, no source file modified",
  "ci": "not applicable to this verification task; the V0.3-12 product head carries the Quality Gate run",
  "dependencies": [],
  "known_issues": [
    "changed_files is exactly the delivery range c35be8b..015a9a7, which contains this evidence file and nothing else.",
    "The reported test result was re-run by the Main Agent, not taken from the worker envelope: 26 passed / 0 failed.",
    "Read-only: this task modified no product file, and its evidence JSON is its whole delivery."
  ],
  "deferred_items": [],
  "ready_for_integration": true
}
